{
  "contractVersion": "md.seating.solve.request/1",
  "modelVersion": "cpsat-model-v1",
  "runId": "diag-2000005",
  "mode": "REPLAY",
  "seed": 2000005,
  "purpose": "PLANNING",
  "tables": [
    {
      "i": 0,
      "capacity": 2
    },
    {
      "i": 1,
      "capacity": 2
    },
    {
      "i": 2,
      "capacity": 2
    }
  ],
  "seats": [
    {
      "i": 0,
      "table": 0,
      "attrs": [
        "A11Y_WHEELCHAIR"
      ]
    },
    {
      "i": 1,
      "table": 0,
      "attrs": []
    },
    {
      "i": 2,
      "table": 1,
      "attrs": []
    },
    {
      "i": 3,
      "table": 1,
      "attrs": []
    },
    {
      "i": 4,
      "table": 2,
      "attrs": []
    },
    {
      "i": 5,
      "table": 2,
      "attrs": []
    }
  ],
  "guests": [
    {
      "i": 0,
      "eligible": true,
      "attrs": [
        "A11Y_WHEELCHAIR"
      ],
      "lockedSeat": null,
      "lockedTable": null
    },
    {
      "i": 1,
      "eligible": true,
      "attrs": [],
      "lockedSeat": null,
      "lockedTable": null
    },
    {
      "i": 2,
      "eligible": true,
      "attrs": [],
      "lockedSeat": 0,
      "lockedTable": 0
    }
  ],
  "units": [
    {
      "i": 0,
      "members": [
        0,
        1,
        2
      ],
      "domainTables": [
        0
      ]
    }
  ],
  "togetherPairs": [
    [
      0,
      1
    ],
    [
      0,
      2
    ],
    [
      1,
      2
    ]
  ],
  "apartPairs": [
    [
      0,
      2
    ]
  ],
  "requireTable": [],
  "forbidTable": [],
  "reservations": [],
  "preferences": [],
  "baseline": [],
  "limits": {
    "maxTimeSeconds": 5,
    "workers": 1,
    "wallSeconds": 90
  },
  "movementTolerance": 0,
  "closureHash": "aa766e53d3d3dd46260bdd8985eb2851a61e5da2156052a75560d814e4ece156"
}