{
  "contractVersion": "md.seating.solve.request/1",
  "modelVersion": "cpsat-model-v1",
  "runId": "diag-2000020",
  "mode": "REPLAY",
  "seed": 2000020,
  "purpose": "PLANNING",
  "tables": [
    {
      "i": 0,
      "capacity": 3
    },
    {
      "i": 1,
      "capacity": 3
    }
  ],
  "seats": [
    {
      "i": 0,
      "table": 0,
      "attrs": []
    },
    {
      "i": 1,
      "table": 0,
      "attrs": []
    },
    {
      "i": 2,
      "table": 0,
      "attrs": []
    },
    {
      "i": 3,
      "table": 1,
      "attrs": []
    },
    {
      "i": 4,
      "table": 1,
      "attrs": []
    },
    {
      "i": 5,
      "table": 1,
      "attrs": []
    }
  ],
  "guests": [
    {
      "i": 0,
      "eligible": true,
      "attrs": [],
      "lockedSeat": null,
      "lockedTable": null
    },
    {
      "i": 1,
      "eligible": true,
      "attrs": [],
      "lockedSeat": null,
      "lockedTable": null
    },
    {
      "i": 2,
      "eligible": true,
      "attrs": [],
      "lockedSeat": null,
      "lockedTable": null
    },
    {
      "i": 3,
      "eligible": true,
      "attrs": [],
      "lockedSeat": null,
      "lockedTable": null
    },
    {
      "i": 4,
      "eligible": true,
      "attrs": [],
      "lockedSeat": null,
      "lockedTable": null
    }
  ],
  "units": [
    {
      "i": 0,
      "members": [
        0
      ],
      "domainTables": [
        0,
        1
      ]
    },
    {
      "i": 1,
      "members": [
        1
      ],
      "domainTables": [
        0,
        1
      ]
    },
    {
      "i": 2,
      "members": [
        2
      ],
      "domainTables": [
        0,
        1
      ]
    },
    {
      "i": 3,
      "members": [
        3
      ],
      "domainTables": [
        0,
        1
      ]
    },
    {
      "i": 4,
      "members": [
        4
      ],
      "domainTables": [
        0,
        1
      ]
    }
  ],
  "togetherPairs": [],
  "apartPairs": [],
  "requireTable": [],
  "forbidTable": [],
  "reservations": [],
  "preferences": [
    {
      "guest": 0,
      "table": 0,
      "band": "HIGH",
      "weight": 10
    }
  ],
  "baseline": [],
  "limits": {
    "maxTimeSeconds": 5,
    "workers": 1,
    "wallSeconds": 90
  },
  "movementTolerance": 0,
  "closureHash": "8078f3e8dc614b7a976bec4ce8e93345dcb6c152b5e635e1c3b635be1791b0f3"
}